,Id,Text,Created,Label,HumanLabel
1947,hnq2tm6,"School fees would be paid since you are a scholar. uhh... seen scholars do start up at school in the entrepuership center. For other expenses, maybe you would want to do some part time by school. There is a telegram channel broadcasting when needed. or... you can be a tuition teacher during weekends and earn quick bucks.  


I have a friend who intern at his own company... it is a matter of consulting the career development center whether it is acceptable.",8/12/2021 15:04,NEU,NEU
1948,rbq3ig,Side hustles as a student,8/12/2021 12:17,NEU,NEU
1949,hnpf244,"No prob! Hope everything goes smoothly, all the best!!",8/12/2021 11:23,POS,NEU
1967,rbe5cz,Happy finals!,8/12/2021 0:45,POS,NEU
99,k8cnhuy,"Uhh even that is not true the moment one hits Capstone Year. :/  


Even with 3 modules right now (Derivatives Pricing & Risk Management, Equity Valuation, and Capstone 1), I am literally struggling lol. I'm from ESD Class of 2024.",8/11/2023 13:00,NEG,NEU
1992,hjsalgt,If I got 25/50 for my midterm am I screwed,8/11/2021 9:29,NEG,NEU
1991,hjsf57j,"i failed my midterm in term 1 math and got the same score as you for physics and i still passed the entire mod ur good 

really think about it exams are only a percentage of your overall grade, and it's hard to get low marks for group work and projects given there's a high probability everyone else wants to do well enough to give a shit about group projects 

all you need is to pass finals because that's a requirement",8/11/2021 10:36,NEU,NEU
38,kgukx8l,U will probably get admitted plus a scholarship no problem.,8/1/2024 4:46,POS,NEU
39,kguiy05,it wouldnt matter,8/1/2024 4:32,NEU,NEU
40,kgufvu6,what if you never took A math?,8/1/2024 4:13,NEU,NEU
37,kgwv7g6,"I dont know anyone, but for ASEAN, T&Cs state that you pay back the full amount that they have paid and provided for you at that point, plus something like +10% as liquidated damages.",8/1/2024 16:23,NEU,NEU
300,jqz344t,"no need to pay anything, i got accepted awhile ago and currently in the ilp programme, didnt have to pay acceptance fee after accepting. only need to pay if you are joining the ssilp programme which registration is already closed. now jus need to wait for orientation which will include fees.",7/7/2023 2:28,NEU,NEU
2172,h4d749t,Make sense! Did u email the school to check for the application results? It says that it will be out in April/May on the webpage tho,7/7/2021 15:57,NEU,NEU
2173,ofg1qu,Graduate research experience at SUTD,7/7/2021 10:16,NEU,NEU
424,jn859ck,"Hi, I just got my interview date! they'll ask you if ur still interested then put you in a list",7/6/2023 7:08,NEU,NEU
423,jnavr56,did you received admission appeal on interview date through email or portal? thanks in advance.,7/6/2023 20:15,NEU,NEU
2217,h0wqvzy,"Not as nevertheless as joe mum
***
^I ^am ^a ^bot. ^Downvote ^to ^remove. ^[PM](https://www.reddit.com/message/compose/?to=YoMommaJokeBot) ^me ^if ^there's ^anything ^for ^me ^to ^know!",7/6/2021 13:58,NEG,NEU
2218,h0wqtck,[removed],7/6/2021 13:57,NEU,NEU
676,jj6n3s7,"Hey, did u manage to appeal? I'm in the same situation as you. I'm an international student too. And I got the ""Undergraduate Merit Scholarship' which only covers the fee of a Singapore Citizen",7/5/2023 7:03,NEU,NEU
677,jj5y6jk,I did international ale. Got an offer on 20/4 interviewed on 10/3 or 9/3 can’t rmb,7/5/2023 2:36,NEU,NEU
679,jj5t31l,sg,7/5/2023 1:54,NEU,NEU
678,jj5t4s9,whats your rp,7/5/2023 1:54,NEU,NEU
680,jj5t1d1,that you got accepted? u sg? whats your rp,7/5/2023 1:53,NEU,NEU
673,jj7o9ot,are you sg? wonder if sutd will give me a reply before the deadline for nus and ntu offers.,7/5/2023 14:24,NEU,NEU
674,jj7o5mz,what rp,7/5/2023 14:23,NEU,NEU
675,jj71e6z,"last year i got in with 76.25 if that helps. Interview was pretty chill. Typical qns like “why sutd”, “which pillar are u gonna go for”, “what are your interests”. i heard of interviews asking mathematical/physics/computing qns but im pretty sure they just wanna hear out your thinking process",7/5/2023 10:30,NEU,NEU
1598,i7q1k9m,whats ur current plan?,7/5/2022 21:20,NEU,NEU
1599,ukdioj,Term 3 Electives + Math,7/5/2022 13:39,NEU,NEU
1600,i7nwq3j,Hi! May I know what is the range of A-Level rank points to enter the SUTD STEP programme?,7/5/2022 10:53,NEU,NEU
1601,i7nwil2,Hi! May I know what is the range of A-Level rank points to enter the SUTD STEP programme?,7/5/2022 10:50,NEU,NEU
1602,i7nwfq1,Hi! May I know what is the range of A-Level rank points to enter the SUTD STEP programme?,7/5/2022 10:49,NEU,NEU
2349,gx8zaba,hey! i want to specialise in biomed engineering in my undergraduate degree and i realise i can choose the epd course for that? (correct me if im wrong) but how exactly does it work... do i have to learn many other things than just biomed engineering,7/5/2021 7:34,NEU,NEU
2350,gx8cygx,"SUTD is partly a design school, does that mean they will teach some design things that can help in UI?",7/5/2021 3:06,NEU,NEU
2351,gx8aszp,"Actually, it's better if you studied art first and learned the technical language to express it. ISTD won't teach you frontend stuff, you'll learn it yourself.

A similar course with regards to user interface design found at MIT is taught at SUTD too. This is really all that's taught. You could probably digest all the course content in one sitting lol. 
https://ocw.mit.edu/courses/electrical-engineering-and-computer-science/6-831-user-interface-design-and-implementation-spring-2011/

Frontend development is more craft than qualification. You have to practice and refine the craft. Show your designs to people. Iterate on your own creative process. Build your own design systems. Your signature style is your selling point as a frontend designer.",7/5/2021 2:47,NEU,NEU
2352,gx8a8o5,"""write good code""
🤣🤣🤣",7/5/2021 2:42,POS,NEU
2353,gx89hjb,"I'm probably the worst person to ask about this, as I didn't attend most classes and hustled alot. I self-studied most of the courses at the last minute prior to exams 😅. Did OK enough to maintain a scholarship 😂🤣

The courses are really just derived off MIT OCW or some other universities, you can self study. HASS is a test of your bulls hitting and speed reading skills, this will come in handy. Generally, if you are good at math, comfortable with advanced calculus, linear algebra, and are good at writing, you'll do OK. Auto-didactism is probably the most essential skill you'll need to acquire. Not everything can be taught, and you'll need to figure things out yourself.

If all you do is follow the set university curriculum you're gonna be really lame 😂, YOLO.",7/5/2021 2:35,NEU,NEG
2354,gx87ycc,"The hustle porn narrative of trying to make it big with handicaps is actually toxic, ignore what I've wrote. You need to deal with the cards that are dealt. 

If you're looking for jobs look for remote roles. I think most companies are moving towards remote first. The job market in Italy is pretty trash atm, so you should think of hustle opportunities online while there. If you're keen on working with crypto and working with DAOs (decentralized autonomous organizations) for internships do DM me I can help. 

AVR and arduino roles tend to be needed in research roles in Singapore, but there isn't a very strong engineering ecosystem. These jobs aren't likely to be part-time, once you engineer stuff you essentially become the domain expert, it's hard to find a new hire to take over immediately. 

The key income generating industries in Singapore are largely finance and oil, so much of the jobs here are driven by Singapore's position as a middleman. The engineering ecosystem here is improving with companies like Dyson in the mix. But generally the competitive salaries here come from finance.

Alternatively, you can try starting up. Find a community which has a problem, solve it for them, and monetize.",7/5/2021 2:21,NEU,NEU
2340,gxazwqn,Oooo see u thr then! :),7/5/2021 18:52,POS,NEU
2341,gxaqxhf,"if i’m not wrong everyone is eligible for it! the details will be sent out around june, i’m going for it too :)",7/5/2021 17:44,POS,NEU
2342,gxadikd,You mean you have the option ready for you?,7/5/2021 16:09,NEU,NEU
2343,gxadakq,Accepted the offer. Still waiting for the option.,7/5/2021 16:07,NEU,NEU
2344,gxa9sxc,"Hi sry i dont really get what you mean by trying, arent you able to choose it once you accept the offer?",7/5/2021 15:42,NEU,NEU
2345,gxa4ohj,Am trying to,7/5/2021 15:06,NEU,NEU
2346,n70754,Early matriculation,7/5/2021 14:47,NEU,NEU
2347,gx9cafw,Sure?,7/5/2021 10:51,NEU,NEU
2348,gx98x7w,I just got the email from SIT for software engin/ info sec program interview... can i pm you?,7/5/2021 10:03,NEU,NEU
954,12eaok8,SMU Information Systems or SUTD Technology Entrepreneurship Program: Which Should I Choose for My Tech Startup Dreams?,7/4/2023 5:10,NEU,NEU
955,jfa6u1b,I’ll ask them,7/4/2023 5:06,NEU,NEU
956,jfa6rfb,"Are they from jc, poly or international? It’s just my speculation but I think they are interviewing jc first then followed by poly and international.",7/4/2023 5:05,NEU,NEU
935,jfcpqpb,I will be paying full fees tho like no MOE,7/4/2023 19:00,NEG,NEU
936,jfcpb1g,I've been called for the first aptitude test at changi airport in a few days time. I'm utterly terrified on what to expect. I have been training at home with whatever sources I can find online. Is there any way else to prepare for this aptitude test? And is there a minimum score or smth to be qualified for the next aptitude test?,7/4/2023 18:57,NEG,NEG
937,jfc7fel,Don't worry about if you stand a chance to be admitted into local universities. You will have little to no chance of getting a student pass to study in Singapore since you terminated your PR to skip NS.,7/4/2023 16:58,NEU,NEU
938,jfbz5mj,"OP wont be admitted

He will be considered an NS defaulter in the system n auto rejected",7/4/2023 16:04,NEG,NEU
939,jfbmcks,ok thank you,7/4/2023 14:39,POS,POS
940,jfblhfk,Its just an example. No need to take my advice literally,7/4/2023 14:33,NEU,NEU
941,jfbgnl6,Thanks for the idea tho.. :),7/4/2023 13:58,POS,POS
942,jfbgmqr,"But then shoudnt I do projects based on smt like data science, Artificial Intelly like that",7/4/2023 13:58,NEU,NEU
943,jfbeqyi,email for me,7/4/2023 13:44,NEU,NEU
944,jfbeoc5,interview was back in early feb. received offer letter 3 days ago. cheers,7/4/2023 13:43,POS,NEU
945,jfbbtil,"Start a project and work towards its completion. For example, you could aim to create a mobile game app. You'll need to decide how you're going to create it (i.e. Unity), figure out the game mechanics, learn to create assets (like characters, weapons, objects) etc. This'll help you learn all the necessary components that go into game creation, as opposed to just learning a language. Goal driven projects may be more complex but the things you learn are more comprehensive",7/4/2023 13:21,NEU,NEU
946,jfbaczt,Went for interview late Feb. Saw offer in my inbox today. See you guys around.,7/4/2023 13:09,NEU,NEU
947,jfb9hpt,Thank you very much... I will start a project. Picking a programming language and do what? Like do courses on it?,7/4/2023 13:01,POS,NEU
948,jfb8btv,"Regardless, it'd be good for you to improve your portfolio. Perhaps look into picking up a programming language, starting a project etc. This'll give you an edge over majority of applicants for any school. All the best in your applications",7/4/2023 12:52,POS,NEU
949,jfb5o18,"I guess its wrong to ask here, but still

Will SIT/SUSS/SIM be great too?",7/4/2023 12:28,NEU,NEU
950,jfb5icv,"yea I am from india, And so these are just approx grades, I am writing my boards next year feb/march so I jsut wanted to see where I stand. So I push my self even more, I will try getting 2A's and 2 high B's... Thank you for your time... :))",7/4/2023 12:26,POS,POS
951,jfb58ss,"What I'm trying to say is you don't apply to a specific course, you only apply to SUTD. Your first year will be a common curriculum, after which everyone splits into whichever pillar they choose. Grades do not matter in pillar selection. 


Your grades look decent. However, it's hard to say that it means you stand a better chance of getting in if you score better. The admissions team looks at your application holistically, such as your achievements, projects/design portfolio, volunteer work etc. On top of this, international students have a different set of criteria when it comes to admissions. There is likely some ratio of local:international students that they'll abide by. Not unheard of for someone to be admitted to improve diversity so that may be to your advantage - most international students I know of are from Malaysia/Indonesia/India",7/4/2023 12:24,NEU,NEU
952,jfb4i1v,"I dont really get what you said, like my chances of getting in is good?",7/4/2023 12:17,NEG,NEU
953,jfb48xc,"You only need to worry about getting admitted into SUTD. Your pillar selection is entirely up to you beyond freshmore year - the school will just let you go to whichever pillar you choose. There are no caps on the intake for each pillar. You just need to get into SUTD, get through freshmore and then go into whichever pillar you choose. If you choose to change pillar halfway through DAI for example, you'll need to restart from the first term (i.e. term 4) of that pillar first",7/4/2023 12:14,NEU,NEU
2549,gtnxjvi,"Okay, thank you!",7/4/2021 7:35,POS,POS
2550,gtnxjb3,"Okay, thanks!",7/4/2021 7:34,POS,POS
2551,gtnngux,It varies by module. Most freshmore groups were random when j was a freshie.,7/4/2021 5:10,NEU,NEU
2552,gtn6aoy,"that is what term 1 is for. it is a pass/fail term. not just exp yourselves with project mates, but also hear from others' exp with their project mates",7/4/2021 2:13,NEG,NEU
2547,gtqzp50,It depends between mod. The 95 percent is mostly on HASS mods. Other mods will vary.,7/4/2021 23:47,NEU,NEU
2553,gtn2kg4,"I'm willing to cooperate with people, but idk how to cope with shitty project members",7/4/2021 1:41,NEG,NEU
2554,gtn28yu,Thank you for replying! Do profs randomly select the group members or you can form your own group also?,7/4/2021 1:38,POS,NEU
2555,gtmzop6,"Most of the projects in the syllabus are group projects, I don’t remember any solo ones to be honest. 

I think part of this cones down to sutd wanting its students to learn how to communicate ideas and negotiate priorities before working in a company.

Yes, shitty groupmates exist. Some just have a bad rep because of miscommunications but some really are in sutd to pass and get some degree. The same’s true for workplaces. Some people just have a bad rep. Some people are just there for their paycheck. You’ll have to learn how to get used to people like that and how you can work with them.",7/4/2021 1:17,NEG,NEU
2548,gtobd5f,gonna be studying in SUTD soon! My A level scores kinda shit to go into NTU and NUS com science so suck thumb go to SUTD com science (ISTD)  hows the grading system in SUTD? i heard smth like u need to get more than 95% to get A (from an old reddit post),7/4/2021 11:10,NEG,NEU
1120,jb91g9l,Thank you so much!!,7/3/2023 9:53,POS,POS
1121,jb8xpuw,alright !! tysm for the insights :),7/3/2023 8:58,POS,NEU
1122,jb8xowv,nope! mine is through zoom haha,7/3/2023 8:57,NEU,NEU
1123,jb8kkun,"Go in and sound passionate. Don't memorize a script, you wouldn't want to sound like you're giving textbook answers. Give some personal anecdotes, you'll sound more sincere that way.

Good luck!",7/3/2023 6:06,POS,NEU
1124,jb8he97,oh so is yours face to face? I think I got a call too but I didn't take it cos idk might be spam call haha.,7/3/2023 5:31,NEU,NEU
1125,jb8h9db,they called me up and told me that they could squeeze me in for an interview tmr and i didn’t want to refuse since i’m dead-set on getting in HAHA so my interview is tmr,7/3/2023 5:29,POS,NEU
1126,jb8geid,I also got an email saying that I secured an interview but I got to book a time slot which allows me to book either tomorrow or next week. Is yours like that too?,7/3/2023 5:20,NEU,NEU
1127,11kpwn5,just secured an interview and in desperate need of tips asap,7/3/2023 5:07,POS,NEU
1115,jbbtq48,Thanks guys!,7/3/2023 22:28,POS,POS
1116,jb9xdkw,"If ur marks more than qualified, it will be chit chat session, more or less guaranteed unless really alot red flags

If borderline then alot physics / math qn",7/3/2023 15:08,NEU,NEU
1117,jb9sz6m,[deleted],7/3/2023 14:37,NEU,NEU
1118,jb9dgny,"Hi, nope but as far as ik, conditional offer just means you need to attend some classes for 5 weeks before school starts so idt it matters that much",7/3/2023 12:26,NEU,NEU
1119,jb9cris,was yours conditional offer,7/3/2023 12:18,NEU,NEU
1772,t8e1k4,English Qualification Submission Delay,7/3/2022 1:43,NEU,NEU
1771,hzox9qz,I think it's best if you ask the Office of Admissions directly,7/3/2022 11:28,NEU,NEU
2783,gq3qv9o,That's really helpful! Thank you soo much :D,7/3/2021 15:28,POS,POS
1858,hvwsdj8,"Eh... from my pov is more of not everything is fully integrated, but someone just said go ahead.

Guides given to students are probably still the old ones.

Quick tips tho. 

1. Bookmark itservicedesk.sutd.edu.sg
There's promotions, quick links, essential programs to downloads, etc

2. Can't reset / unlock your account? Server not operating? Probably using the old site that is still up for some reason. Use the EASE portal for that.

3. Outlook not working?
The webmail should probably still work. Log into Ease and you should still be able to use.

4. Account lock out? Use your phone to unlock your account via EASE
There is a button under ""Login"" that says ""Need help signing in"" 
U can reset / unlock there.

5. New phone who dis. 
If still have old phone, keep it to register your new phone.

Died? Just call / email the helpdesk.


6. You really just need 2 websites to redirect to most of the other sites.

ease.sutd.edu.sg
itservicedesk.sutd.edu.sg

If you need anything else, its probably just your pillar / dept.",7/2/2022 5:33,NEU,NEU
2848,leq6wq,Using PS4 in hostel,7/2/2021 16:52,NEU,NEU
65,kcf8deg,Yes sure,7/12/2023 22:26,POS,NEU
66,kceodm9,"Hello thank you for your reply, is it okay for me to dm you for further questions ?",7/12/2023 20:21,POS,NEU
67,kccy0yx,"Hi, 

Welcome to SUTD 

1. I have no experience with the ML module, hence I could only speak for the DB module. There are 5 hours of contact hours per week. 2 * 1.5 hr lectures / 2 hr cohort class (lab and tutorial).
2. There are homework, group projects, class participation and the final exam.
3. a) software design principles that are typically taught during first two years, abstraction, composition, encapsulation, and etc. b) understanding of multi-threading and concurrency, scheduling and deadlock c) OS basics, processes, file I/O, memory management d) Java Programming (or C#, or Python).
4. Normally 1 week or 2 before the term starts, i.e. mid Jan?


Hope that helps.",7/12/2023 12:51,NEU,NEU
1969,hnkrvxc,"It's been a while and I can't remember when I received my Term 2/4/6 results, but the results should definitely be out by mid Jan. Freshmores might get their results back earlier than other students because of Bootcamp, but you're asking about a pillar mod so this sentence is irrelevant.

If it's of any consolation, I missed a 15% quiz for a pillar mod once, and scored terribly in the other quiz and both exams (I don't remember if we got our results back, but I do know I had no idea what I was doing at all; I just couldn't grasp the main parts). Thought I was going to fail, but somehow managed to get a D, which my pillar considered as a pass for that particular mod.

All the best!",7/12/2021 9:58,NEG,NEU
1970,hnkqrkx,I was actually referring to overall results thanks! May I assume around mid Jan?,7/12/2021 9:41,POS,NEU
1971,hnkokpk,"Final exam results are almost never released I think, but if you're referring to the overall result for a mod, then normally a few weeks after Week 14, through MyPortal.",7/12/2021 9:09,NEU,NEU
1972,hnknjm2,Hmm... That's new... I do hope I pass. Do you know when results tend to be released? Thanks btw!,7/12/2021 8:54,POS,NEU
1973,hnkae3w,"If i recall, the answer is “sometimes”. Depends on the course and prof.",7/12/2021 6:07,NEU,NEU
1974,hnjybjw,Yeah I guess... But may I ask if you know if 45-49% can net a pass?? Cuz from my school a 40% tend to give you a pass. I'm on exchange from NUS.,7/12/2021 4:14,NEU,NEU
1975,hnjxv2b,Whoa but they agreed to let you make up for it alr a very huge deal leh. Silver Linings I guess...All the best.,7/12/2021 4:11,POS,NEU
1976,raq9s8,Failed to turn up for finals,7/12/2021 4:07,NEG,NEU
1968,hnkspsq,Thanks a lot for the info and consolation :),7/12/2021 10:10,POS,POS
1977,hnj37j5,"Hmm bad phrasing on my part, wanted to emphasize how the career path of EPD is like how many imagine engineers to be like",7/12/2021 0:26,NEU,NEU
100,k862a9y,Well i see from nus it looks pretty bad lol,7/11/2023 3:33,NEG,NEU
101,k8624r2,Wait are you serious? If i can i really want to,7/11/2023 3:32,NEU,NEU
102,k85yoaf,Yeap 78.75 will get you in for sure. I know quite a few people with under 70 RP in my class now. You honestly could get a scholarship with 78.75 RP.,7/11/2023 3:07,POS,NEU
103,k85b0ti,where did u read abt the enormously better mental health?,7/11/2023 0:24,POS,NEU
1223,j3de05i,"So…
- GPA is important sadly, there is a minimum bar that needs to be hit. The rationale is that the academic pace is quite fast
- do your own projects that you could show
- participate in SUTD activities, you might be able to go for things already happening

Otherwise don’t be demoralised! I’m heartened you see value in our community",7/1/2023 19:43,POS,NEU
1908,hrlp9w2,OK thanks,7/1/2022 5:58,POS,POS
1909,hrllcfi,"Just to be real transparent, I scored about 37/45 for IB and manage to make it in. I would imagine them allowing someone slightly lower than that to be admitted too.",7/1/2022 5:22,NEU,NEU
1910,hrlku5o,Just from your knowledge how many IB points would they consider for the application since I am neither a citizen nor PR,7/1/2022 5:18,NEU,NEU
2907,gigmfcp,esd is my favorite pillar,7/1/2021 20:05,POS,NEU
1319,ina4yy1,"FULL LIST PROVIDED BY UNI

SUTD Housing

Front Desk

Student Housing

SUTD Housing: Things to bring

The items listed below are some suggestions you may wish to bring for your stay on campus:

* Clothing suitable for tropical weather
* Clotheshangers
* Bed sheets, pillow covers, comforter, duvet for single bed(Length 190cm x Width 91cm)(bed linens are not provided)
* Water Bottle
* Slippers and shoes
* Towels and hand wipes
* Bathrobe
* Personal toiletries and bag/bucket to carry them into shower
* Dental and body hygiene items
* Toilet paper roll
* Shower flip-flops
* Sanitizing product
* Tissues
* Clothes hamper/basket Laundry detergent/stain remover/fabric softener/dryer sheets for top loading washers; laundry bag or basket
* Hair dryer
* Iron
* Cleaning supplies (Broom & Dustpan)
* Basic first aid kit
* Prescribed medication
* Favourite eating supplies, e.g., coffee mug, cutlery, plates, pots and pans, food storage containers and microwavable containers
* Laptop / Tablet
* LAN cable
* Mobile phone
* Alarm clock
* Flashlight
* Calculator
* Pencils, pens, markers, ruler, scissors, stapler
* Audio and music device
* Sewing kit
* Binders, paper, and notebooks
* Photos of friends and family
* Posters & other decorations that will not damage the walls
* Poster putty
* Umbrella

Please DO NOT bring the following: Pets, Furniture, Kitchen appliance, Wireless router, Candles and open flame devices",6/9/2022 5:56,NEU,NEU
223,15jklm8,How to Choose the Right Fifth Row for a Career in Software Development,6/8/2023 8:44,NEU,NEU
1423,ij6tuxp,"Only regret is not making enough friends.
But then again it's my catchphrase everytime I graduate 😭",6/8/2022 14:32,NEG,NEU
1424,whmpkz,"Current/ past students of SUTD, is there anything you regret after joining SUTD? ☕",6/8/2022 12:02,NEU,NEU
307,14s32fk,"Preparing for a PhD Program Interview at SUTD, Looking for Tips and Potential Questions",6/7/2023 8:49,NEU,NEU
301,jqvtb9s, Congratulations on being accepted to SUTD!,6/7/2023 12:51,POS,NEU
302,jqvi5fv,I am international :),6/7/2023 11:05,POS,NEU
303,jqvi1nz,[deleted],6/7/2023 11:03,NEU,NEU
304,jqvhirp,today actually,6/7/2023 10:57,NEU,NEU
305,jqvg2uu,"Oh wow, congrats on getting into SUTD, may i ask when did u got the offer????",6/7/2023 10:41,POS,NEU
306,14s4ysf,fees,6/7/2023 10:23,NEU,NEU
425,14254y6,sutd appeal,6/6/2023 5:37,NEU,NEU
426,jn23nfv,Yup! SUTD emailed me on 22nd May to wait for results in the first half of June. They offered me a place provided I do the summer bridging course (SS-ILP) in July first.,6/6/2023 0:18,NEU,NEU
2219,h0u06qx,"You'll need to run R analytics stuff and Java stuff, unless you're doing deep learning stuff around a MacBook air specs would be sufficient

If you're going to do alot of deep learning stuff I recommend having two computers: a laptop to carry around, and a desktop with powerful compute with a beefy gpu (just get the most powerful GPU available) if you think you'll be doing alot of GPU compute. Cloud computing is a possibility but can get expensive quickly.",6/6/2021 20:33,NEU,NEU
2220,h0tnmyj,yo man i saw your previous comment that you got 75rp! same here. feels super bad that people think of “NUS-> NTU -> SMU -> reapplying again next year”.,6/6/2021 18:56,NEG,NEU
2221,h0td835,"i used a surface pro 4 till terms 7-8. i used a thinkpad T440p then.

if you need to train machine learning models, rent. unless you fully intend to do tons of ML, silicon is ex now and not worth the expense. besides ML you're probably not going to run many complex algorithms that jam up a modern computer.",6/6/2021 17:35,NEU,NEU
