,Id,Text,Created,Label,HumanLabel
1943,hntr5sw,"I heard from a friend in another local uni that one of their friends transferred to SUTD after a year in the other uni, studying a completely different major. So it is possible, though I suppose the number of people who transfer universities is not very large to begin with and so we don't hear of many such stories? I doubt you'll be at a disadvantage just for transferring; there's a lot more factors to applications.

I think you should push through with your application! If I'm not wrong it's free to apply too (compared to like $10/$15 for other local unis???), so the only cost is really just time and opportunity cost. Worst case, at least you'll have started putting together a portfolio if you haven't already, which will come in handy regardless of your application's outcome.",9/12/2021 7:13,NEU,NEG
1941,hnuamvw,"That's a good deal. I remembered when I failed to turn up for my final, because I was the only one in my clique taking that module, I spent the whole night studying and remembered the timing wrongly. I failed and retook that module. But that was in another local uni.",9/12/2021 11:41,NEU,NEU
1942,rcfv5s,Laptop recommendations for SUTD ( preferrably DAI ),9/12/2021 11:35,NEU,NEU
1990,qq2qf8,How bad must you really do to be in BootCamp T1?,9/11/2021 12:35,NEG,NEU
143,k4496pn,Probably. But i do know most of my colleague are from local varsities. From SIT to SMU,9/10/2023 11:44,NEU,NEU
144,k444scy,[deleted],9/10/2023 10:58,NEU,NEU
1292,xzowcy,What is the SEED programme like?,9/10/2022 15:51,NEU,NEU
35,kh0c0cv,"If tuition fees was included in the benefits, do i have to pay back all the tuition fees covered before? or only the other additional monies that were given as part of the benefits?",9/1/2024 4:38,NEU,NEU
36,1923kw2,Advice?,9/1/2024 2:29,NEU,NEU
1315,inlj9ia,"Why is it out of the question? Most ppl staying in hostel get their own fridge, a lot of seniors pass it down when they’re graduating.",8/9/2022 15:12,NEU,NEU
1316,inkwsi7,"Okay. Buying my own fridge seems out of the question to me. 

Anyone who wanna share their fridge here? Willing to pay for a per day rent lol.",8/9/2022 12:30,NEU,NEU
1317,inkw8pd,"There are no common fridges. You can buy one and keep it in your room, which has a fee. Around $25 per term. 50L if it's just for you or you have a single room. 100L if you're in a double room and sharing with your roommate",8/9/2022 12:26,NEU,NEU
1318,x8y5a6,Looking for fridges in the hostel,8/9/2022 11:36,NEU,NEU
1422,ijf2isd,"I reckon SUTD curriculum being so diverse and the cohort being comparatively small, you would have made a lot of friends while in SUTD especially since you need to stay in the hostels for the first 2 terms.",8/8/2022 8:41,POS,NEU
2102,h85cwpy,were you still able to attend orientation and classes though??,8/8/2021 8:06,NEU,NEU
2103,h855f7b,"You should collect on the appointment date cause ICA is likely to turn you away if you don’t make an appointment when you come. 
There’s no need to worries tho cause last year I didn’t collect my pass till end October. (Due to complication with covid so it’d also take longer to make an appointment)",8/8/2021 6:22,NEG,NEU
2104,h852dqb,"[https://cwr.sutd.edu.sg/faqs/](https://cwr.sutd.edu.sg/faqs/)

You can visit this website that covers the FAQs of EWET!",8/8/2021 5:43,NEU,NEU
2105,p0737x,student pass collection,8/8/2021 3:12,NEU,NEU
2099,h866xxp,"Hey I have been there. KEEP CHECKING GHE APPOINTMENTA! SLOT WILL ALWAYS CHANGE PEOPLE WILL CANCEL THEIR APPOINTMENT ANY TIME.

I GOT SEP BUT 5 MINS LATER I CHECKED BACK I GOT EARLIER DATES!",8/8/2021 14:21,NEU,NEU
2100,h85uxvf,oh cool!! alright thank you 😭😭,8/8/2021 12:24,POS,POS
2101,h85o1fg,"Yup. No one actually checks my pass tbh😂
I just occasionally received mail from OSA reminding me to get my pass as soon as possible.",8/8/2021 10:54,NEG,NEU
290,jr5qyok,"Oh you'll receive soon, after you've completed your OMEx",8/7/2023 15:01,NEU,NEU
291,jr5nfl3,Congratulations 🎊,8/7/2023 14:34,POS,NEU
292,jr5dxyy,Omg congrats! Me toooooo!,8/7/2023 13:16,POS,NEU
293,jr5dqhu,Yep! Got my offer yesterday and I was notified via email.,8/7/2023 13:14,POS,NEU
294,jr5d2or,Count me in plssssss!,8/7/2023 13:08,POS,NEU
296,jr5cn5z,Interviewed on 14 June offered yesterday anyone wants to make friends with me www,8/7/2023 13:04,NEU,NEU
295,jr5covx,Did you got offer so far?🌟,8/7/2023 13:04,NEU,NEU
297,jr5cid3,Interviewed on 14 June offered yesterday,8/7/2023 13:02,NEU,NEU
298,jr5cdj5,Accepted offer yesterday haven’t received any email so far,8/7/2023 13:01,NEG,NEU
299,14u24mw,Anyone who plan to accept the SUTD offer?,8/7/2023 11:49,NEU,NEU
2166,h4g3ce4,"1. no, u gotta bring ur own cleaning equipment

2. afaik they dont care if u stay in hostel or not, my roomie didnt even use the room at all n went home everyday haha",8/7/2021 6:30,NEU,NEU
2167,og1kai,What I don't have to bring for my stay and whether I can go home on weekdays,8/7/2021 6:26,NEU,NEU
2168,h4g0qs4,Thank you very much for a very insightful response🤩😁. I will definetly take everything into consideration.,8/7/2021 5:55,POS,POS
2169,h4g0ksv,Thanks a lot!!,8/7/2021 5:53,POS,POS
2170,h4fs0c4,Well I did that and they told me they are in the midst of sending out letter of offer. Did you get an update of your application?,8/7/2021 4:12,NEU,NEU
2165,h4hm8lu,yea i basically had no roommate during my entire stay as he wasn't in at all. When i started dating someone from class we were basically sleeping in my room almost everyday so they don't even care where you sleep,8/7/2021 16:26,NEU,NEU
2171,h4f3aot,"Just graduated from the PhD programme a while back, here are my responses:

**Research Experience:** I really appreciated the interdisciplinary nature of SUTD which not only helped a lot in building one's academic portfolio but also gave a chance to interact with people from specialisations might not even typically talk to. This is especially so if your advisor's research team is comprised of researchers or other PhD students from various backgrounds, which helps in understanding how others think or do research. 

**Faculty**: Most faculty are very approachable and willing to help or collaborate with you, even if you are from a different pillar. I think this is bolstered by the fact that SUTD is still rather young and have hired a number of recent PhD graduates whom are open to trying out new things in their career. In fact, I feel that most profs are open-minded and are more willing to share the details of their own research, even in casual conversation. 

**Hurdles**: That said, most hurdles which I faced during my research would be dealing with certain admin departments. In general, getting approvals for *certain* matters might take more time than you would expect, in a university setting, which might hinder your research schedule. So it's best to factor that in if your research is 'less conventional' than the norm, especially when charting your research timeline.

**Internships**: Depends on your pillar. It's more mandatory for EPD track, but less so for ASD. I'm uncertain about ESD, ISTD or HASS though. 

As for international internships, I guess this is dependent on your contacts and subject to approval from the grad student office. Of course, the one greatest obstacle is overcoming Covid restrictions right now since Singapore (and even SUTD) is rather conservative in dealing with this.

Hope this helps and feel free to DM me if you need more info.",8/7/2021 0:28,POS,POS
421,jncu9m4,"Ohh thanks for the information. Didn't know it was unpaid, might reconsider it then.",8/6/2023 4:50,NEU,POS
422,jncapeh,they WhatsApp-ed me directly yesterday cos the interview is tmrw. All the best!,8/6/2023 2:03,POS,NEU
419,jne5a4k,"I messed up the photo also, and part 1 a little incomplete. Somehow the whole form autosubmitted and I can’t log back in lol cause it’s considered “complete” , I talked to the school and it seems like it’s not too big of a deal. You can ammend it after you matriculate in Sep apparently",8/6/2023 13:37,NEG,NEU
420,jne2knn,"Ik what to do, but it's hard to explain by typing here. Dm me, and we can do it on discord/zoom/meet",8/6/2023 13:16,NEU,NEU
1505,v7v3ql,"For existing/incoming students of SUTD, what is your RP and portfolio like?",8/6/2022 17:31,NEU,NEU
2215,h10f2fx,It should be part of the scholarship contract document or its annexes,8/6/2021 8:59,NEU,NEU
2216,h10dhpd,"Hi! Which document should i search for regarding the list of study-related' items that could be reimbursed through the scholarship? 

&#x200B;

Thanks!",8/6/2021 8:33,NEU,NEU
667,jjcb5j3,"Same, but I dont have any interviews, just the ASD sketch evaluation email to submit",8/5/2023 14:44,NEU,NEU
668,jjbr3dp,"22nd march and still nothing, all the best man",8/5/2023 12:04,NEG,NEU
669,jjbpu2s,ohh 😯 okay thanks,8/5/2023 11:52,NEU,POS
670,jjbow80,"Not inclusive, so if you are not on any scholarship or other financial aid you get to save $12000 over 8 terms.",8/5/2023 11:43,NEU,NEU
671,jjbmv6e,Bureaucracy moment,8/5/2023 11:21,NEG,NEU
672,13bl2q2,Where is my resulltsss!?!?!!?,8/5/2023 10:34,NEG,NEU
1597,i7qu4w3,The current plan is to just search and learn about the various topics via the internet for DES since the school provides a week by week breakdown of the topics. For DDW I’ve found a GitHub resource of the weekly breakdown so I am going to learn those via YT. Not sure about maths though,8/5/2022 1:18,NEU,NEU
1596,i7s68gg,Hi sorry but do you mind sharing the link to that ddw  github resource? I'm taking DDW next term as well.,8/5/2022 10:22,NEU,NEU
2337,gxcydfd,im going for ss ilp 🤒,8/5/2021 5:29,NEU,NEU
2338,gxcuh7g,haha see ya!,8/5/2021 4:40,POS,NEU
2339,gxcdegc,Hey i just wanted to know what response did you get from the University as I am in almost a similar situation,8/5/2021 1:48,NEU,NEU
2334,gxdp4tu,"I sent in an email asking about the scholarship (after my outcome) and they told me I hadn’t qualified for one and they’d reconsider my scholarship application after my final results. So, even if they didn’t mention it during the interview ig it’s alright...
Maybe send in an email asking about it?",8/5/2021 12:14,NEU,NEU
2335,gxdmjou,"hi sorry!! idk what’s that 

Edit: im also going :)",8/5/2021 11:42,NEU,NEU
2336,n7m6al,Life as a gay University student,8/5/2021 10:14,NEU,NEU
923,jffdyuq,"Hello. I'm an international student with international qualifications. I got an interview invitation on March 8th and I completed my interview on March 15th. I applied on January 23rd if I remember correctly. But I think you can still keep ur hopes alive as it's still the beginning of April. If I'm right, they shortlist applicants for interviews until the end of April. So, don't worry :)",8/4/2023 9:47,POS,NEU
924,jff516p,not a JC student,8/4/2023 7:36,NEU,NEU
925,jff410q,Nope nothing yet,8/4/2023 7:21,NEU,NEU
926,jff3r7f,"I'm from a local jc, but I'm PR. I doubt that matters though.",8/4/2023 7:17,NEU,NEU
927,jff39zr,ahh congrats :)) are u a jc student by any chance?,8/4/2023 7:11,POS,NEU
929,jff36zz,oo congrats ! may ik if ur a jc or poly student? or int haha,8/4/2023 7:10,POS,NEU
928,jff38cf,congrats for the acceptance !! are u local or international?,8/4/2023 7:10,POS,NEU
930,jff3603,"hi, have u heard back yet?",8/4/2023 7:09,NEU,NEU
931,jff358b,hopefully that’s the case 🥲 thanks for the insights!!,8/4/2023 7:09,POS,POS
932,12fdpk3,does any international qualification candidates shortlisted and received the interview dates??,8/4/2023 6:27,NEU,NEU
933,jfewv1f,My interview was on 23 Feb. Got offered today (8 Apr),8/4/2023 5:46,NEU,NEU
934,jfefrfj,"Don’t stress and just do your best. Having a writing pad and pen will probably help. 

Don’t overthink, just do

Also with regards to scoring and stuff, i am not privy to such information so I can’t help. I don’t even know my own score",8/4/2023 2:50,NEU,NEU
920,12fom4y,"Post UEE, did anyone receive an interview call or any communication?",8/4/2023 15:00,NEU,NEU
921,jfg0h4t,Thank you:) Good luck to you :)),8/4/2023 13:50,POS,POS
922,jffykrb,wow congrats! and thank you for ur kind words ;),8/4/2023 13:35,POS,POS
2546,mmhiyj,fifth rows,8/4/2021 2:01,NEU,NEU
2544,gttcu4t,"Stereotypically, if you get good grades and fifth rows records, it looks great to applying for programs in sutd, like an overseas program or taking minors.

But if you want to get a job, you must be wanted by the industry, meaning taking up projects that give an indicator that you have a particular set of skills.

But in hindsight, what do you really want? Would you mug all the way and get your first-class honors? Or have a decent grade and have a good life balance?

What is a priority? It is not really determined by the school. In fact, sutd allows you to make your own unique self, or portfolio.

Sutd kinda gives you quite a lot of opportunities. Officially, we got urops, honor programs, fifth-row projects, and whatnot, which is a low starting effort. Unofficially, you can kajiao prof or get from seniors/alumni if you make strong enough connections. Or rather, you will be pushed to make connections, and eventually, get what you want. Haha. In fact, that is what it is like when working outside in the industry.

So ya, maybe discover more, rather than being binded by the education system, as if it is a must-do to-do list curated by someone.

And ya, fifth rows can be competitive, but I don't think you need to be that competitive in order to secure an overseas program (more emphasis on grades)

And for portfolio, it is not whether you have won 1st prize or whatnot, but rather the skills you have in the end. Okay, maybe 1st prize will help HR filter through the first round, but I think what matter more is the interview in the next round",8/4/2021 14:41,POS,NEU
2545,gttc1dk,"they're important to your mental health if you ask me. yes, most have leisure sections separate from competitive sections, at least when I was a student. They're usually not competitive. to be frank my transcript lists some ridiculous number of fifth rows i'm a part of, but really some of them feel more like mailing lists. and that's not a bad thing, you get to do what you're interested in.",8/4/2021 14:35,NEU,NEU
1108,jbdur7c,Are you international? Or Singaporean?,8/3/2023 9:42,NEU,NEU
1109,jbdu07r,So how did it go?,8/3/2023 9:31,NEU,NEU
1110,jbdml08,is it possible to get in with c in both h2 phy and math,8/3/2023 7:46,NEU,NEU
1111,jbdkcy2,"I studied CSD at SUTD. Computer Science


I have colleagues who’ve done Psychology, Mathematics, Social Sciences, Physics, Mechanical Engineering, Electrical Engineering

There isn’t a specific degree that my company looks out for when hiring.",8/3/2023 7:16,NEU,NEU
1112,jbd8tph,Hi may I know what are the relevant degree to get into ATC!,8/3/2023 5:05,NEU,NEU
1113,jbd0xzh,thank u ! will do :),8/3/2023 3:53,POS,NEU
1114,jbd0v61,oh my….i got a 66.25rp 🥲 i guess i’ll have to quickly run through my old jc notes HAHA,8/3/2023 3:52,NEU,NEU
1091,jbf7e6j,hi may i ask what’s your rp and do you have a very good portfolio?,8/3/2023 16:51,NEU,NEU
1092,jbessuq,Yes please,8/3/2023 15:16,POS,NEU
1093,jbesoje,May I DM you the details?,8/3/2023 15:15,NEU,NEU
1094,jbes0dh,"When did u apply and received your interview call.. can u specify your grads, profile and country as well",8/3/2023 15:11,NEU,NEU
1095,jberrhg,I'm an international student.,8/3/2023 15:09,NEU,NEU
1096,jberpy9,Okay. Thank you :),8/3/2023 15:09,POS,POS
1097,jberglt,Are you international or Singaporean,8/3/2023 15:07,NEU,NEU
1098,jbei4gb,"I doubt the interview will specifically be about ESD; applicants apply for admission to SUTD, not a specific pillar.

If things haven’t changed, the interview will be for both interviewee and interviewer to determine whether SUTD is a good fit for the applicant, and vice versa.

Also, there have been multiple posts on this sub regarding admission interviews, you might find more information in them.",8/3/2023 13:59,NEU,NEU
1099,jbeaje6,Was there a technical test? On maths/science.. Curious to know if it has changed since my interview was 10 yrs ago.,8/3/2023 12:54,NEU,NEU
1100,jbe96r7,"Ooo congrats:)

May I ask how it was like? Becos I have an interview this friday too😬",8/3/2023 12:42,POS,NEU
1102,jbe82ff,pretty well!,8/3/2023 12:31,POS,NEU
1101,jbe82y5,singaporean :),8/3/2023 12:31,POS,NEU
1103,jbe7afd,Hey so how did the interview go? What kind of questions did they ask you?,8/3/2023 12:23,NEU,NEU
1104,jbe6obv,& What course were they from,8/3/2023 12:16,NEU,NEU
1105,jbe6nob,Hi do u come across anyone who studied SUSS / SIT?,8/3/2023 12:16,NEU,NEU
1106,11lt62x,SUTD Interviews - ESD,8/3/2023 10:46,NEU,NEU
1107,jbdyqiz,[deleted],8/3/2023 10:39,NEU,NEU
1770,hzuabd9,"For admission interviews (not special programmes), “why SUTD” and questions about your past experiences (depending on what you wrote in your application). It’s an interview for both interviewer and interviewee to find out about whether SUTD is a good fit for the applicant and vice versa, so it’s really more of a casual chat. Math/Physics questions may be asked, but I have no experience with that and cannot say more there.

Ping u/Ahemahemexcuseme",8/3/2022 14:36,NEU,NEU
2778,gq6zcrg,so what I'm getting is that if I do live in Jurong there's a good chance of getting to stay?,8/3/2021 9:10,POS,NEU
2779,gq6vvd8,My nonna? Aren’t their food any good?,8/3/2021 8:13,NEG,NEU
2780,gq6l1f6,"Damn, was hoping to stay in hostel throughout",8/3/2021 5:37,NEU,NEU
2781,gq6h0b1,[deleted],8/3/2021 4:50,NEU,NEU
2782,m06slx,"Current students, what are some things you wish you knew before joining SUTD?",8/3/2021 3:32,NEU,NEU
2772,gq83d4t,"Highly dependent on who else applies. And also where you stay in Jurong (near/far from mrt). It is calculated based on time taken by public transportation. Staying right beside Jurong East mrt (Travel time 1hr+) is approximately the same ""distance"" as someone in Punggol.

So yea, hard to say. Apply if you need it; If you don't get it, subject to case-by-case approval by OH, an appeal might help. Just know that the system is meant to prioritize those that need housing and might miss some. It's a realistic quantitative measurement meant for decision making.",8/3/2021 16:22,NEU,NEU
2773,gq80q2c,"Hey hey, House Guardian here. And no.

The only 3 criteria used are:

1. Disciplinary conduct. Ie: abiding by hostel rules.  
\- receiving a letter of warning/notice of breach is basically a surefire way to kill your chances
2. Participation in hostel activities  
\- to meet minimum participation count based on your period of stay; more terms = more events  
\- participating in more than required does not improve your standing (non-competitive nature)
3. Distance from campus based on time taken to travel from registered home address by public transportation

Might have some tweaks by the time you matriculate (who knows), but the system aims to provide housing for those who need it most, not encourage competition. Unfortunately, due to limited beds, it's impossible to provide a room for everyone :(

On the note of being a House Guardian to secure housing, you still have to satisfy the requirements as any other student would. On top of that, you will be assessed based on how well you have served your role as a House Guardian before your contract is renewed (yes, it is contractual. Because subsidies, PDPA and more :P). Tough job as well to ensure hostel conduct is maintained, planning events for residents and general pastoral care day to day. If you enjoy doing that, then take up the role when you join SUTD.",8/3/2021 16:03,NEG,NEU
2774,gq7urn3,Food is not just not good... is xxxxxxxxxxx not good,8/3/2021 15:20,NEG,NEU
2775,gq7tuxi,"Not to my knowledge. The main things which decide are time of first class in the week, distance of home from campus and fifth row appointments. Signing up as a house guardian is one way to guarantee housing since you are required to stay on campus. As a trade off for being a hostel admin, you get subsidised rates.",8/3/2021 15:13,NEU,NEU
2776,gq7n0wp,[deleted],8/3/2021 14:18,NEU,NEU
2777,gq79bv9,"Lived in Central, stayed in hostel start to finish. Having a fifth row appointment helps.",8/3/2021 11:54,NEU,NEU
1857,hw1wafh,Hi for year one I heard it’s not graded? How does that work? Also cuz I’m not the best in math and science too so wondering if SUTD is for me..,8/2/2022 6:36,NEG,NEU
2846,gmkbs56,there's an entrance exam??,8/2/2021 8:54,NEU,NEU
2847,lf4gm8,University Entrance Exam,8/2/2021 4:57,NEU,NEU
2842,gmlcawg,"I know international students have entrance exam to sutd(one prospective students' dad, who was my colleague, randomly asked me during my internship lol). Our freshies are the first batch doing it. I don't expect past paper on that.

My 2 sense is that just take a local A level paper do it for practice for whatever subject being tested. I mean that is roughly the standards to enroll into sutd...",8/2/2021 16:02,NEU,NEG
2843,gmkxq5l,"Okay, thank you so much!",8/2/2021 13:59,POS,POS
2844,gmkxd6e,"Typically people will participate in Open House and join the University Ambassadors club. However, in these pandemic times, those are probably a bit out of the question. Maybe you can check with the Office of Marketing and Communications regarding virtual Open House, or maybe the Office of Student Admin for other avenues...? I don't know which office is the most suitable for the latter haha",8/2/2021 13:56,NEU,NEU
2845,lfad46,When and where can I earn give-back hours?,8/2/2021 12:01,NEU,NEU
1950,hnp102v,"Thank you, Gamillie, for voting on bot-killer-001.

This bot wants to find the best and worst bots on Reddit. [You can view results here](https://botrank.pastimes.eu/).

***

^(Even if I don't reply to your comment, I'm still listening for votes. Check the webpage to see if your vote registered!)",8/12/2021 7:59,POS,POS
1951,hnp0zlg,Bad bot,8/12/2021 7:59,NEG,NEU
1952,hnowujm,Wait why have I seen you literally everywhere lmfao,8/12/2021 7:02,NEU,NEU
1953,hnowih5,"Got this, I’ll do brush up on this before the term starts! Also, would they be offering physics in the early matriculation or should I really self-study on my own for physics?",8/12/2021 6:58,NEU,NEU
1954,hnowg4x,"Thanks for letting me know! Also, what grades do they look for in Math AA HL and Chem HL? Do I need to get 7s in both to have a chance or are 6-7s okay? I’m struggling a bit in Math AA as my teacher can’t teach at all...",8/12/2021 6:57,NEG,NEU
1955,hnowdg0,"You're definitely going to have Physics in SUTD so brace yourself, please study some AP Physics beforehand lol. I don't know but I don't think it would affect your application too much, just knowledge-wise you might need to prepare.",8/12/2021 6:56,NEU,NEU
1956,hnovoml,Stolen from another meme site. Anime is Zombieland Saga,8/12/2021 6:47,NEU,NEU
1957,hnovmqh,"Shakespeare-Bot, thou hast been voted most annoying bot on Reddit. I am exhorting all mods to ban thee and thy useless rhetoric so that we shall not be blotted with thy presence any longer.",8/12/2021 6:46,NEG,NEG
1958,hnovm3o,"Yea, coequal worse, mine own group project teammates art downright hilding

***



^(I am a bot and I swapp'd some of thy words with Shakespeare words.)

Commands: `!ShakespeareInsult`, `!fordo`, `!optout`",8/12/2021 6:46,NEG,NEU
1959,hnovlgx,"Yea, even worse, my group project teammates are downright useless.",8/12/2021 6:46,NEG,NEG
1960,hnovk7s,Zombieland saga,8/12/2021 6:45,NEU,NEU
1961,hnouij1,sauce?,8/12/2021 6:32,NEU,NEU
1962,hnofff7," No physics hl shldnt be an issue to get in but term 1 physics imo has a sudden spike in difficulty. they will still want to see final grades. May ib you only get like a few days to accept the offer, and everything is pretty rushed cos term starts in sept. iirc some people do the interview before they send it final results based on predicted, but you still need final.",8/12/2021 3:51,NEU,NEU
1963,hno4xrw,"I actually do not have Physics in my school, so I opted to take Chemistry HL instead. Would I need this topic for SUTD?",8/12/2021 2:21,NEU,NEU
1964,hno4oit,"My school doesn’t offer Physics at the moment, so I took Math AA HL and Chemistry HL. Would this really put me at a disadvantage? I’m an M23 student. Also, will SUTD only look at my predicted grades or will they also be checking my finals grades after externals? I don’t do extremely well in long exams and I’m worried this might pull down my grade.",8/12/2021 2:19,NEG,NEU
1965,hno4fqb,"Oh, that’s great! Thanks for letting me know! I’ll keep this in mind!",8/12/2021 2:16,POS,POS
1966,hno1vdc,"As a prev ib student who was average at hl math and hl phys (and struggling right now), I recommend looking through the AP course (workbook and videos), for topics on angular kinematics",8/12/2021 1:55,NEU,NEU
1944,hnqhxzm,math 6 is probs the best realsiticly cos 7 boundry is insane. 4-5 can get in but u will nd to do math questions during the interview.,8/12/2021 16:46,POS,NEU
1945,hnqa9kv,"Thanks so much! Wishing the best for you, too!",8/12/2021 15:56,POS,POS
1946,hnq3fax,"to be honest, i dont see a lot of applicants here that have taken undergraduate studies before, as credits are not transferrable. But, I think it is worth a try, and starts from scratch, if you believe in sutd curriculum. Application wise, just present yourself good to the school and what you can offer should be sufficient. It is a very short interview.  


p.s. not a international applicant",8/12/2021 15:08,NEU,NEU
