,Id,Text,Created,Label,HumanLabel
178,jzswku1,"I have done an Aptitude test but I am aware that they have changed it and I heard it’s a lot tougher now

My advice is bring pen and paper and be mentally prepared to do a minimum duration of 2 hour test which aims to test on: Logic, Arithmetic, Cardinal Direction, Spatial Awareness, Memory and Reaction.

No background is needed. Maybe try playing League/Diner Dash/CS:GO/Papers Please",9/9/2023 11:39,NEU,NEU
179,jzso3ue,"Good day sir, Im taking my Feast test 2 this coming Wed, anything to expect or tips ? Its some sort of a radar simulation. Have you done it during your time ?",9/9/2023 10:01,NEU,NEU
2023,hc5syyt,"Hi, you should have received some emails from clubs in your student outlook email. You can sign up for the intro sessions using the form links!",9/9/2021 8:53,NEU,NEU
2024,pkre3k,Fifth Rows,9/9/2021 5:19,NEU,NEU
222,jveme8g,ur sutd email is just ur first name_lastname@mymail.sutd.edu.sg and when u try to login it will bring u to the ease login page,9/8/2023 5:33,NEU,NEU
1419,ijlmvoi,"Each term we have to take 4 mods, but from what I know from T4 onwards we can overload and take an extra mod per term. When I spoke to my academic advisor she recommended not to do this though, since the workload for SUTD is already pretty tough. I think it also depends on which track you're in since certain mods may be required and they are only held during certain terms.

If you matriculated early, you would have the option to clear some mods before officially entering the school (only first year mods/HASS) so you could clear those credits beforehand. From what I heard from my friends graduating in 2025 they didn't have this option under early matriculation anymore though, probably need to check this.

Generally though, I doubt it is possible to graduate SUTD earlier than everyone else would.",9/8/2022 16:47,NEU,NEU
1420,ijl0zxo,Marvellous! I see now!,9/8/2022 14:28,POS,NEU
1421,ijkxwya,"You can work during school term , [for a maximum of 16 hours a week.](https://www.moneymate.sg/student-pass-work-in-singapore)

""Additionally, your work needs to meet one of these requirements:"" Only need to meet one, not both.",9/8/2022 14:07,NEU,NEU
2098,h8am1tf,OMG OK ON IT AM GONNA CHECK EVERYDAY,9/8/2021 15:16,POS,NEU
281,jr93tje,"utterly devastated, got a good decent rp, they asked me to go for interview everythin went smooth, i had to reject my other offers because i was confident that i’ll get in and that the deadline was nearing , turns out appeal unsuccessful, asked them why and they don’t know … i’m thinking it might be cause of the high demand of applicants, both foreign and local",9/7/2023 7:47,NEG,NEU
282,jr8vvvo,"20 - successful appeal outcome 
17 - unsuccessful appeal outcome 
14 - haven't received one yet

Will update the comment every 2 hours once . Pls  don't vote to see the results

Last upadted 9:58 am 16 Jul (sg local time)",9/7/2023 6:04,NEU,NEU
284,jr8k9o6,"Yes, I was",9/7/2023 3:59,NEU,NEU
283,jr8kbrz,"Cool, thanks so much man",9/7/2023 3:59,POS,POS
285,jr8jro7,"So just to clarify, ur paying around 6k per semester right?",9/7/2023 3:54,NEU,NEU
286,jr8jlc8,I'm not sure for international students but for locals its half so per semester. They'll normally email you in the first week of the semester and you'll have about 4 weeks to submit your payment,9/7/2023 3:52,NEU,NEU
287,jr8ie8m,"When they bill u, is it the term bill? Or the academic year bill? Like, its cost 29k for 1 academic year, so when i get billed, do i pay for 29k, or 14.5k",9/7/2023 3:41,NEU,NEU
288,jr8i64r,"Academic year is a whole year but tuition fees are billed per semester, so you'll be billed twice a year (there's rarely an instance you'll be in school for 3 consecutive semesters, the max is 2 per year based on academic calendar). You will not be billed during your 4 month summer/winter break.",9/7/2023 3:39,NEU,NEU
289,jr88cf8,"Hey, i also international student, ans I also just receive the offer on friday",9/7/2023 2:12,NEU,NEU
278,jrbt0qb,"How about now ;) 
Hahah",9/7/2023 21:46,POS,NEU
279,jrbszin,"Just updating this thread, I'm still at 3.89 outta 5 after Term 6 so yeah looks like it's possible hahahaahah",9/7/2023 21:46,POS,NEU
280,jr9vhhl,"Hey things like this happen and it’s okay. Instead work on something you can change like your portfolio. Try taking internships, lesson, or projects to beef up your portfolio for next year. I did not graduate with excellent gpa or anything but I try to beef up my portfolio and I manage to get the offer. 
All the best to you!",9/7/2023 13:27,NEU,NEU
2161,h4ka58m,Thank you!!,9/7/2021 6:04,POS,POS
2162,h4ka2g2,"I'm from ESD actually, quite different from EPD I believe. In terms of advice, I can't really help much because I don't know what makes a good application. personally I just put a lot of passion into my personal statement, and made sure to contact and talk with my intended supervisor before applying.",9/7/2021 6:03,NEU,NEU
2163,h4k96l4,That's great! Are you from EPD pillar? I am interested in applying for the EPD program. Any advice for sending in a good application? 😃,9/7/2021 5:51,POS,NEU
2164,h4k8c68,"Hi, currently am phd student in sutd. To briefly answer your questions:

1) Research experience so far has been good. The school makes a lot of resources available and there are ample opportunities for collaboration.

2) Overall culture is friendly, though perhaps less close knit these days due to most people working from home. From the short time I spent in and around campus in my first year it was a very pleasant experience. The faculty members are generally really great as well, and are very approachable.

3) I believe all phds have to do at least 1 internship/research attachment, usually in the 3rd or 4th year. International internships might be hard to come by given covid though.

One thing I feel could be a very subjective matter is the size of the student body. Being from a very small pillar, we only have a few students every year and although this results in us being closer as colleagues and friends, it does result in resource pooling (i.e. sometimes courses are not available to us because there are only going to be 3 people taking the course if it were offered). Other than that sort of minor issue my experience has been positive so far.",9/7/2021 5:40,POS,NEU
2155,h4lq419,"1. iirc you can change pillar **within 2 weeks of starting the pillar term.** Don't worry, they will email you with all the necessary info when they ask you to choose your pillar. As for the credit, it's only 2 weeks of lessons so there is nothing to transfer :"")
2. Yes you can transfer the credits. And, again, there will be instructions to do so :) just wait for it",9/7/2021 15:54,NEU,NEU
2156,h4lpnjf,"Hello :)

I went for the DATE programme under GLP. Its a 3-months exchange/intern to China. Had to pay everything myself but the programme actually offers grants (only to citizen iirc). The grant is quite big and could cover most of the travel/accoms/personal expenses.",9/7/2021 15:51,POS,NEU
2157,h4lmocu,"Its very chill imo, but depends on your friends HAHAHAHA

Most of the time, ppl are too tired/busy to do wild shit, and ppl usually just hang with their close friends so don't expect frat parties.

Aside from that, SUTD hostel is fairly neww so it's actually way nicer and cleaner than this hall u speak of. There's a hostel lounge where u can play foosball, darts and board games. There are pantries where u can cook, and recreational rooms with tv and beanbags if u wanna play yr switch or watch movies. There are house guardians (RA) on each floor, they usually hold floor events so u can get free food and socialise with your floormates. It's a pretty good hostel experience tbh.",9/7/2021 15:28,POS,NEU
2158,h4lkdn7,"ohh I see! no I actually haven't, it still says submitted on the webpage and no emails as well! do you know of anyone that received an offer?",9/7/2021 15:11,NEU,NEU
2159,h4ljld5,"hello there! Sorry I did not take IB, but from personal experience, SUTD looks at your CCA/leadership experiences as well. I had a friend who scored fairly low (60ish out of 90 rank points) for A levels, but he received the offer for SUTD. So I guess just try your luck! All the best :)",9/7/2021 15:05,POS,NEU
2160,h4lj7zx,"Hi there! Congrats on getting into SUTD :)

1. Nope, cleaning equipment are not provided so you might wanna borrow your roommate's or buy your own! Personally, a kind cleaner gave me broom and mop so if you are tight on budget you may consider asking the cleaners :) 
2. You can sleep wherever you want! It is recommended to stay in hostel coz you'll get to know other students and it's like 10 mins from campus lel

Hope you enjoy your uni hehe",9/7/2021 15:02,POS,NEU
417,jni75z1,"You gotta upload it first, that will give you the white box. Then upload again, but don’t click upload but instead hit cancel.

Then it would pop up the crop box. Use that crop box to crop is then upload it

Source: an acquaintance whose method worked for me lol",9/6/2023 8:22,NEU,NEU
418,jnhrtq4,"Ohh alright, thank you!",9/6/2023 5:11,POS,POS
413,jnkh8jb,"The school has a list of clinics that have been “informed” of the checkup e.g raffles,health way etc.

But u don’t have to go to any of those medical groups if it’s inconvenient or you decide not do, you can just go to any gp who does any kind of  health check service (best to ask of course beforehand) it says this in the student guide",9/6/2023 19:24,NEU,NEU
414,jnj863h,"Haha it is like the deluxe package for like a full medical check up from raffles hospital. More like you are going there when you want to buy private insurance.

 But, OP, you don't need that. A simple check up from the clinic listed in the application would do. It probably cost 30 ish dollars, if not at most 100. If you can claim for the checkup with your private insurance or what not(wink wink I dk whether army insurance can cover), please claim. At least save some $$$",9/6/2023 14:30,NEU,NEU
415,jnj2y4m, frm what i rmbr i went for the raffles medical at tampines 1 but i’m not sure what package u’re talking abt,9/6/2023 13:54,NEU,NEU
416,jnivqnd,i had the same problem but subsequently managed to submit using firefox!,9/6/2023 12:59,NEU,NEU
1502,ibp3039,"81.25 rp class chair, vp for cca, exco planning  for camps and ogl, a lot of via stuff, have done research projects",9/6/2022 4:31,NEU,NEU
1503,ibozx3e,"65rp. co chair for class via, represented sch for sports comp. Took triple science during sec sch.",9/6/2022 3:59,NEU,NEU
1504,ibok7qb,"Among my friends who have early matriculated or are joining, they're around 85rp with pretty good portfolio. One of them has H3 research and has experience pitching to investors, another was the student council prez in jc and started his own business. All of them did internships before uni began. They weren't able to land tech internships bah, but they were able to force out certain useful tech elements within their job such as creating web scrappers etc.

But then again these guys are heading to step, so the rp/portfolio is definitely skewed.

You can check out a similar previous post about rp:
https://www.reddit.com/r/sutd/comments/cpmvg3/sutd_rank_point/?utm_medium=android_app&utm_source=share",9/6/2022 1:42,POS,NEU
1501,ibpth9r,"68rp, sports cca exco + adiv representation, headed a couple of external volunteer projects (sec sch + jc), did some design projects, won a few writing awards. did tripsci + cca captain & ogl in sec sch",9/6/2022 10:39,POS,NEU
2214,h14u3my,"Why not sign the contract, and then apply for STEP after your contract ends since the cyberNSF contracts ends before you finish your uni education? 

You get the best of both worlds haha",9/6/2021 9:40,POS,NEU
666,13cidye,Application timeline,9/5/2023 7:13,NEU,NEU
662,jjgcbvv,Would it be possible to notify me as well,9/5/2023 10:47,NEU,NEU
663,jjgc50c,"Same haven’t heard from them, I even emailed them twice. The application status still stated processing.",9/5/2023 10:45,NEG,NEU
664,jjgb1jp,Ya lab attachment,9/5/2023 10:31,NEU,NEU
665,jjgazzz,Exchange program is it?,9/5/2023 10:30,NEU,NEU
1595,ulpf28,*grabs popcorn,9/5/2022 11:49,NEU,NEU
2333,gxg4u2a,Ok thanks!!,9/5/2021 1:00,POS,POS
2323,gxiijbe,I did write to my school and got a reply about the grant! Thank you so much for your help!!,9/5/2021 16:58,POS,POS
2324,gxii8o5,"Oh thank you so much, I was actually asking about the number for the grant. Thank you so much for clearing my doubt🥺

Yes I read about the details for student pass and other formalities in the admissions info kit provided by them. Thank you so much for your reply☺️

Yess, I have received the unibuddy mail and I had a conversation or two with some second year students and they were really helpful!😌

Thank you again for helping me out!!",9/5/2021 16:55,POS,POS
2325,gxie7dy,[deleted],9/5/2021 16:22,NEU,NEU
2326,gxiddzr,"Hello, I'm not from India but I did accept the offer from SUTD. However they did not send a follow-up email regarding my acceptance.

I think the matriculation number will be given to you once you matriculate on 8 Sep. In case you are asking this for the Tuition Grant, you will apply for it after you matriculate (i.e. after you obtain your matriculation number).

SUTD will release information regarding student pass and others from June onwards, so be sure to stay updated.

As a side note, SUTD will have weekly chats open on Unibuddy every Wednesday in the month of May (you should have received an email regarding this if you have received the offer), so you can ask your questions there as well.

Hope this answers your questions :)",9/5/2021 16:15,NEU,NEU
2327,gxhws9n,Oh thanks! I was under the impression that we wld have to go for all.,9/5/2021 13:53,NEU,POS
2328,gxhwhbz,Thanks!,9/5/2021 13:49,POS,POS
2329,gxhoy00,"basically is the bridging program haha you can choose between math/physics, bio/chem and computing! https://www.sutd.edu.sg/Admissions/Undergraduate/Transition-Into-SUTD/Special-Summer-Integrated-Learning-Programme",9/5/2021 12:29,POS,NEU
2330,gxhovnq,july!,9/5/2021 12:28,NEU,NEU
2331,n8cdty,SUTD 2021,9/5/2021 11:31,NEU,NEU
2332,gxhes7s,"Hello I’m going too 
But I’m currently working 😣any idea when it starts??? 
Is it June or july",9/5/2021 10:04,NEU,NEU
918,jfjn302,Nope what about you,9/4/2023 7:19,NEU,NEU
919,jfj8kkn,Whats uee ah,9/4/2023 4:31,NEU,NEU
917,jfkfj08,"I read somewhere ""University Entrance Exam""",9/4/2023 13:20,NEU,NEU
1685,i41tvz4,ESD is really balling this year,9/4/2022 16:19,POS,NEU
1686,tzvuqr,SUTD Graduate Employment Survey 2021,9/4/2022 15:44,NEU,NEU
2542,gtw0xhk,Not yet. They said they’ll announce it at the end of April of Early May,9/4/2021 3:00,NEU,NEU
2543,gtvsnjd,thanks for the insight!,9/4/2021 1:45,POS,POS
2533,gtxcpz6,"Large syllabus overlap with other computer science courses but with heavy emphasis on ML/AI based on elective options available. Course content on OS is rudimentary. There are no modules for advanced OS stuff, compilers, advanced algorithms. Basically if you're interested in the low level areas of computer science, it might be a better choice to pursue a degree in another uni. If you prefer ML/AI and those kinds of buzzwords then this might be suitable for you. As an ISTD grad, I think the course worked out for me because my interest is in ML/AI, although I wish they had an advanced algorithms module. Feel free to DM me if you want need more info/in-depth opinion.",9/4/2021 13:05,POS,NEU
2534,gtx79wn,"Off the top of my head for Summer Early Matriculation:
1. Bridging courses for those who forgot many things from NS
2. Participation in fifth rows and competitions
3. Student privileges (ie. student card, events/activities, afaik TA)",9/4/2021 12:14,NEU,NEU
2535,gtx6xie,"Heard it differs greatly per person. Seen them asking some basic maths/physics questions for some people whereas others get more generic questions (like which pillar you'd like to go, since the interviewer may not be the prof from the pillar you're interested in)",9/4/2021 12:10,NEU,NEU
2536,gtx6e30,"HAHAHAHA I'm still in year 2. But I'm planning to early matriculate next year! 
I'm not sure how many tips I can give you since I went to pasir ris camp (aka commando training institute) instead of tekong for bmt so...",9/4/2021 12:05,NEU,NEU
2537,gtx665b,"Hey bruh u class of 2027 cus of NS, have u done NS alrdy?cus I'm gg next week got tips",9/4/2021 12:03,NEU,NEU
2538,gtx5g9x,"Well the focus tracks/specialisations offered by SUTD is the same as those offered by CompSci courses in other unis like SMU/NUS/NTU. (ie. Cyber Security, AI, Data Analytics, Computer Vision). Which is different from the specialisations from other unis' info sys such as Business Analytics, E-commerce, digital innovation etc",9/4/2021 11:55,NEU,NEU
2539,gtx4jpm,"Oh, Idc abt business I thought information systems is like a branch of computer science or something",9/4/2021 11:45,NEU,NEU
2540,gtx1vj6,"If you define information systems as computer science + business, then no, it is definately more on computer science. 

You can take a look at the tracks and mods provided: https://istd.sutd.edu.sg/education/undergraduate/tracks/

iirc ISTD started off as a mainly info sys pillar but slowly turned into a computer science pillar it is now (heard this from the head professor in this year's open house)

Heard from many sources that they're considering changing the name to CSD (computer science design) but I can't confirm that",9/4/2021 11:14,NEU,NEU
2541,mnelo5,Is ISTD more on information systems or computer science?,9/4/2021 10:52,NEU,NEU
1089,jbie3n6,Wow...thank you for taking your time to type all these. I'm really grateful to you. Thank you very very much for all these details. 😄,9/3/2023 6:53,POS,POS
1090,jbib1uw,"Heyooo I was just like you, first time uni interview as well. Like the previous comments, the questions they ask are not really specific to the course u opted for cause it’s only after the common year programme u get to choose (I didn’t know this until the interviewer told me lmao) what I did was I sourced out all the questions sutd asked previously from online and prepared for it. Generally they ask questions like 
1. Tell me about yourself
2. What did you choose sutd over other Uni 
3. What inspired u to choose that course 
4. I personally got 2 mcq math qns (it’s easy if u rmb the basics like algebra and graph)
5. I didnt get this qn but my friend got an estimation qn 

also don’t worry too much because the interview is more like a student teacher conversation they are usually very friendly. A tip for u is interviewers usually like to test u if you’re really keen in the course by discouraging u and telling u reasons why u shouldn’t join. HOWEVER don’t fall for the trick 🥲 they just want to test if you’re scared now and have back up plans (my friend kena at this qn) that’s about it and best of luck 💕💕",9/3/2023 6:16,NEU,NEU
1088,jbj1f14,good!,9/3/2023 12:05,POS,NEU
2771,gqb42t6,"Wait im rly confused. Thn how do they decide if u can enter the pillar? Cause if its true that we can go to whichever pillar we choose and its not based on grading, wouldnt smth like: one pillar being too popular and all the students choosing that pillar while the other pillars wont have enough students for a class",9/3/2021 8:31,NEU,NEU
2767,gqbz3l7,Eh. I got it. not easy for sure tho.,9/3/2021 14:50,NEU,NEU
2768,gqbytxv,"Yes, you can choose which pillar you want, no questions asked. It's actually an issue ESD has faced in the past because it was such an unusual course that it got disproportionately fewer students though that has balanced out over the years.

The idea that students apply to a major isn't universal, and neither is it universally agreed that applying to a uni to study one thing only is ""better"". SUTD (or its board, or whoever decides on the curriculum) believes that the base provided by the freshmore curriculum enables students to communicate similar concepts. How true that is varies on which student/alumni you ask, but if you ask me, a lot of modules are very relevant.",9/3/2021 14:48,NEU,NEU
2769,gqbu2ff,"Like I said, if the pillar selection policy and procedure does not change, you will get whatever pillar you indicate.

I get where your concern is coming from, but I believe that is statistically unlikely. It is true that the ISTD population has boomed in recent years, while the ASD cohort appears to keep getting smaller, but I do not believe any pillar will be unable to attract even a single student anytime soon. Yes, there will be a strain in terms of resources for a more populous pillar. Yes, it might be that less-subscribed courses will be cancelled for a batch if there is insufficient interest (an example I can think of is one of the Term 7/8 ESD courses, which had less than ten people indicating their interest in it in an official survey). However, if a pillar already doesn't have that many students, I'm sure the admin people will be a bit more willing to have smaller class sizes. And I doubt SUTD would force students to go to another pillar if a pillar is seriously undersubscribed. I'm sure they'll find a way to deal with it unless they want to face some serious backlash.

And also, as I said in an older comment a longass time ago because I'm lazy to rewrite it:

>imo it is ridiculous to tell someone to go to another pillar that they may be even less interested in just because they have poorer grades and that pillar is less subscribed, and this may possibly signal ""hey this pillar is less worthy than this other pillar"" which is Not Cool

Of course, policies may change, but I'd like to believe that SUTD management has some common sense at least in terms of pillar selection.",9/3/2021 14:10,NEU,NEG
2770,m15p6d,SUTD qns,9/3/2021 12:48,NEU,NEU
1852,hw7b34c,"If you are smart yes. You can finish homeworks and assignments quickly you will have time.
If you are a normal peasant(like me sobs), be prepared to spend hours grilling over questions that take the smart ones minutes..

Best of luck..",9/2/2022 8:46,POS,NEU
1853,so8r2q,Work-Study-Life Balance In SUTD,9/2/2022 8:36,NEU,NEU
1847,hwam0jb,"Nev'r bethink about weekend and early catch but a wink again ere graduate

***



^(I am a bot and I swapp'd some of thy words with Shakespeare words.)

Commands: `!ShakespeareInsult`, `!fordo`, `!optout`",9/2/2022 23:32,NEU,NEU
1848,hwalzav,Never think about weekend and early sleep again before graduate,9/2/2022 23:32,NEU,NEU
1849,hwa8hcv,"as i recall, year 1 felt a little busier since there are lab sessions. pillar years were less taxing in terms of required time spent on the curriculum. almost everyone i knew had some form of side hustle or were involved in extra projects since there was spare time. a very rough estimate of time required per module is 4h a week if you choose the less time consuming ones and can go up to 10h for the more rigorous ones. should be easy to check. i remember 1 hass module i took only had 1 final exam, 1 final essay and project while another mod had weekly reflections, 2 essays, 2 exams and project🤣",9/2/2022 22:03,NEU,NEU
1854,hw5yu64,oic haha interesting,9/2/2022 1:37,POS,NEU
1855,hw5uvi2,I think everyone gets the math test to determine if they need to make ILP compulsory for the candidate,9/2/2022 1:08,NEU,NEU
1850,hw7qzky,"Hey there, thanks for the reply. I guess i'll try my luck (though i don't expect anything tbh)",9/2/2022 12:05,POS,POS
1851,hw7ob3x,"Not a dumb question. 

Term 2 student here. Dont be discouraged, just apply with whatever score you have. 

Based on my observation, alot of the students from poly have some form of prior work /internship/ side hustel/ competition experience. Strongly suggest you highlight these experience ( along with a letter of recommendation) in your application",9/2/2022 11:36,NEU,NEG
1856,hw5r80t,"a while back (interviewed in 2014), it was the case that technical questions under the math and science subjects were asked only for students who barely met the cut-off point. wondering if this still holds true today in your experience or does everyone get the mini math test now",9/2/2022 0:42,NEU,NEU
2839,gmq8wvc,"Chillax buddy! You'll soon realise that in the grand scheme of things, your current mods don't matter AS MUCH as you think it is. It's important to learn the basics of course, but it ain't the end of the world if you get even a C+ buddy. Think you should take it slow, catch up with helpful TAs if needed, and enjoy 3.007 right now haha trust me :)It gets easier, but you gotta do it everyday, that's the hard part :o",9/2/2021 19:03,POS,POS
2840,gmor9g1,"Around 100% if you are average, 0% if u are trash.

That being said GPA just icing on a cake. Focus on improving yourself. If there's a scholarship to maintain and you cannot maintain it don't worry too much. Just get rich. Money > GPA.",9/2/2021 11:29,NEU,NEU
2841,gmomggb,B is around the average of the whole cohort in sutd generally. So maybe get just a bit more than average?,9/2/2021 10:13,NEU,NEU
