,Id,Text,Created,Label,HumanLabel
682,jj2e3m4,"M. but if cannot find then it shouldn't matter too much for just travelling i guess?
Edit: since I plan to rent a room myself and share the flat with someone else, I don’t think gender actually matters",6/5/2023 8:13,NEU,NEU
681,jj31vlg,i got sent an email alr,6/5/2023 13:09,NEU,NEU
683,jj14lpf,haven’t heard from them. they’re legit ghosting me and my friends who applied for it. i’m just gonna accept they rejected us entirely (international btw).,6/5/2023 0:22,NEG,NEU
1603,i7ilmfn,"For NUS, I think it is much more niche in computing in first if I recall correctly. So like in sutd, you explore different parts cus interdisciplinary (so it is situation of opportunity cost... Whether you want to switch in nus, and study way harder to catch or lose out in sutd if you decide to choose nus) (sorz for the negativity... Just to emphasize haha)",6/5/2022 4:24,NEU,NEU
2362,gx4jgqt,"You'll get more and better internship opportunities as a computer science student vs self learning, which would further increase your chances of getting hired. Also, things taught in ISTD such as how to write good code, how computer systems and networks work together are invaluable to any software developer, even if it's just front end. Lastly, you get to meet like-minded people which will definitely help you in your journey.",6/5/2021 7:30,POS,NEU
2355,gx7o0ih,that's a good point although id extend it to asd as well. i cant really give an answer on that since im still just a freshmore in my first year so i dont really have experience being in pillar,6/5/2021 23:31,POS,NEU
2363,gx3j05h,Yes it will cover ui ux to certain extend but it will not be the main focus. It is more towards computer science so like machine learning AI etc. It will help you to be more rhan just a front end developer or UI UX design,6/5/2021 1:05,NEU,NEU
2364,gx3ionk,"But does it also cover some things useful for UI/UX?I mean k want to be a computer scientist, I think maybe ISTD will teach some things that will help too.",6/5/2021 1:02,POS,NEU
2356,gx5wigj,Thanks! I'm still waiting for SMU :'),6/5/2021 16:00,POS,POS
2357,gx5r226,ooh congrats!!! i havent heard back from SIT at all.,6/5/2021 15:22,POS,NEU
2358,gx5g0f4,So would u think the school tend to give more attention to EPD as compared to other pillars? With the focus on the fab labs and related facilities,6/5/2021 14:01,NEU,NEU
2359,gx5eqad,"Would u think the smaller class size gives the student better learning environemt? 
And I see SUTD's endowment is pretty big tho, abt 1/3 to half of NTU",6/5/2021 13:51,NEU,NEU
2360,gx4wzgl,[removed],6/5/2021 10:58,NEU,NEU
2361,gx4upy2,thank you!,6/5/2021 10:27,POS,POS
2365,gx3hdi8,"You dont need a degree to be a front end or full stack developer. All you need is a course on udemy. For example Full React.js course, html css bootstrap web design theories. 

ISTD would be a waste of your money because it covers way more than just frontend or ui ux development.

So unless you change your career prospect, any of the degrees offered would be worth it",6/5/2021 0:51,NEU,NEU
2366,n5ukr1,Is ISTD good if I want to be a UI/UX/front end web developer?,6/5/2021 0:12,NEU,NEU
960,jf5p0zr,"Hi, my interview was on 23rd Feb, and I received an offer today.",6/4/2023 7:10,POS,NEU
962,jf5m6an,[deleted],6/4/2023 6:32,NEU,NEU
961,jf5m7l8,Today??.. can u please dm me,6/4/2023 6:32,NEU,NEU
963,jf5m0tf,[deleted],6/4/2023 6:29,NEU,NEU
957,jf7x2fp,"Date Applied - 9/3/2023  
Shortlisted - 10/3/2023  
Interview - 15/3/2023",6/4/2023 18:44,NEU,NEU
958,12dt65t,"Dates applied, Interview dates, Offer Letters",6/4/2023 18:25,NEU,NEU
959,jf6r8a9,You (and your friends) gave the UEE?,6/4/2023 14:10,NEU,NEU
2564,gtjupqh,I graduated from high school long ago,6/4/2021 9:21,NEU,NEU
2565,gtjufif,predicted?,6/4/2021 9:16,NEU,NEU
2566,gtjqbee,I apply with Int'l scores,6/4/2021 8:05,NEU,NEU
2567,gtjo3ft,sure no problem!!!,6/4/2021 7:28,POS,NEU
2568,gtjg2qh,It was about slopes.,6/4/2021 5:29,NEU,NEU
2569,gtjf92v,Thanks :) for the math question isit under h2 math syllabus like stats or??,6/4/2021 5:18,POS,NEU
2570,gtjck46,Second batch? like those who wrote the uee?,6/4/2021 4:44,NEU,NEU
2571,gtjadj1,"hi! not sure if it'll make u feel better but im a local student and did my interview on 25th march, i would say the interview went smooth-sailing, i have yet to receive any follow up too. the interviewer told me they'll likely get back to me in april, i think sutd has yet to send out their invitations for the second batch",6/4/2021 4:19,NEU,NEU
2556,gtmczs9,"I was in the inaugural CyberNSF batch. I can tell you the training isn't easy. Back then I was in SIT and I WANTED to come back camp. Fuck the stay out and the temporary student life. I don't even wanna know what you'll face in NUS. 

I didn't make it, but my friends who did, they are now juggling working life, soldier life, and student life, all for around 2.5k a month iirc. Is it worth it? I leave it up you.",6/4/2021 22:04,NEG,NEU
2572,gtisuty,Wow thank u so much for sharing! U helped me made up my mind,6/4/2021 1:36,POS,NEU
2557,gtl9xk4,"They are project within the syallabus, and also projects outside of syallabus(urops, fifth rows)

Sometimes, it can be solo, but most of the times is group project

The good thing about projects is that you talk to people. Revising what you learn and bond with friends at the same time. Don't stress so much

There are some times you will be burnt out, but with good friends, it is quite bearable",6/4/2021 17:16,POS,NEU
2558,mlgmrj,Query about projects in SUTD,6/4/2021 17:13,NEU,NEU
2559,mlghic,Interview prep,6/4/2021 17:06,NEU,NEU
2560,mlgffm,SUTD UEE importance,6/4/2021 17:04,NEU,NEU
2561,gtl843w,"Hey hey, am a T5 EPD Sophomore. I do have an eng. background in Poly, so I can't tell you if physics is difficult. In general, understand that everything has to obey the laws of physics. If something doesn't line up you either discovered the hole in fabric of space time, or more likely did something wrong. For formulas, try to relate the variables based on their units instead of just memorising the formula. (until you meet dimensionless variables and have your mind blown -.-)

Personally for me, freshmore was an eye opener. I did not study bio for the 7 years leading up to uni. However, the syllabus in SUTD taught me to not memorise memorise memorise like what everyone says bio is all about. I found bio to be challenging but fun, and for things I did not understand I'll consult friends that studied bio in JC.

Courses are mostly well structured with one concept taught each week, with the following week's concepts building on past weeks. Ask as many questions as you can during lessons, be it directly related to the topic currently being taught or otherwise. If you fall behind during lectures and tutorials, consult your profs and teaching assistants (TAs) (Most are quite approachable) and your fellow classmates. You'll be fine. Trust.",6/4/2021 17:03,NEU,NEU
2562,mlf1sx,Is SUTD freshmore hard?,6/4/2021 16:04,NEU,NEU
2563,gtkiio1,Ohhh like gradient? Thanks for all the help & advice :) i’ll let uk how it went!,6/4/2021 13:53,POS,NEU
1128,jb2toqd,Did u get in? Or what happened? Can u tell me the full story,6/3/2023 0:23,NEU,NEU
1129,jb2tcwx,Did u get in?,6/3/2023 0:20,NEU,NEU
1773,hzl2rdf,"Hi, what are frequently asked qns in the interviews?",6/3/2022 15:37,NEU,NEU
1859,slwikv,"Ngl, I don't really like navigating the SUTD Portal either",6/2/2022 13:20,NEG,NEU
2850,gm6vw3h,"Just know if you are considering DAI,

Electives seem like it will be shared with ISTD AI track, with design innovation and business aspects sprinkled in between. Currently in EPD T5, so based on what we know (rumors and speaking to Profs during DAI's early conceptualization),

Looking to develop AI? ISTD AI Track

Looking to utilize AI in business? DAI",6/2/2021 2:33,NEU,NEU
2851,gm6uj2n,"u/nightlockyy can confirm. It is still the same right now.

1. No Letter of Warning (LOW)/Notice of Breach (NOB). This is pretty much the major factor. Breaking Safe Distancing rules/any other major offence is the sure fire way to get one
2. Hostel event attendance. It is meant to be non-competitive and it's 1/term. So if you are offered 3 terms of stay (incl Summer if you applied for it), you are required to participate in min 3 events. If you are a freshmore in the new acad system, it's Term 1 and 2 stay, so 2 events. You will not be given an advantage for anything more than your required number. But then again, events are for the fun of it.
3. Distance you stay from campus, measured by time taken using public transportation. However, the hostel houses both undergraduates and graduates, as well as SM2 students. It is meant to provide a place to those that truly need it.

There is an appeal process if you do not get a place, with strong justification. Alternatives are to rent a place nearby, usually with friends; That's usually pretty rare for someone with local address though.",6/2/2021 2:21,NEG,NEU
2852,gm6u4up,"yep i think they look more at your character, cca points /commitments, and your interview",6/2/2021 2:18,NEU,NEU
2853,gm6s0a0,"Well if it's SSA, SSA specifically states it is a ""firm offer""; ""regardless of your actual result"".

Come to think of it I might have been admitted through SSA as well, given I was recommended by my polytechnic course manager during my final term. Never knew SSA was a thing. Did not realize till now and already in Sophomore Term 5 \*facepalm\*",6/2/2021 1:59,NEU,NEU
2854,gm6q7l2,"Agree. 3.89 if that matters. I applied with T5 GPA tho so it was higher lol. The reason you are unlikely to find students with lower GPAs in Uni could be due to those individuals not giving it a try, discouraged by low GPA. If you really have interest, just give it a shot; You never know ;)

The interview process, I believe, is what really draws the line between whether you are offered the place/not, given the drive of the students you find here. If you are offered the interview, it's more about character, teamwork and passion for your goals.",6/2/2021 1:43,NEU,NEU
2849,gm85r4l,great to hear that! thanks alot!,6/2/2021 12:45,POS,POS
1982,hnfvj8b,"Incoming SUTD student here, my info is based on my research, hopefully another senior can add on:  
1. ESD is abit like the IS where you're able to apply skills (design, analysis, optimisation), to various industries. Many core mods are analytics related such as ""The Analytics Edge"" and ""Data and Business Analytics"". Whereas EPD is more of the traditional physical engineering like mechanical, electrical etc.

2. From what I know all pillars are built on from the freshmore subjects, so no background is required. But being an engineering school, having a background in STEM is ideal.

4. You can add anything to the application, if u're targetting ESD/EPD, maybe some projects would be good (this is purely based on options, no one truly knows)

5. IB curriculum should be applicable to all Singaporean Universities, so SATs shouldnt be a requirement, but it can be a good addition to give a better gauge of your understanding",6/12/2021 9:24,NEU,NEU
1983,ra2rou,Prospective SUTD Student Advice,6/12/2021 8:48,NEU,NEU
1978,hni6izg,"I won't say epd is traditional. We do have courses like 3d printing, MEMS, beyond industry 4.0. Courses in epd are kinda evolved to suit the industry needs.",6/12/2021 20:41,NEU,NEU
1979,hnh2a87,Ib score depends on whr u from and subject combo. There is not officially set req subjects but uh math and physics hl are nice to have and are pretty much required if u want to survive. If ur nov IB then not as nessicary cos u can do ilp classes which cover term 1 math and physics. may ib glhf  if you dont have math and/or physics hl. Ib score wise to be safe id say 34-36 min ofc higher better. But they mainly seem to look at math and science  scores. sats unless u got ivyleague level dont bother trying sg uni dont care abt them. documents same regardless of eventual pillar choice but if u got interesting stuff you did thats related to them then include it. As for standing out being in Ib alr helps w that kek.,6/12/2021 16:19,NEU,NEU
1980,hngepfm,"Has been a while since I've applied (around bmt period last year). Last I recall they took all my credentials from the government so I didn't hv to individually key in my results. Main thing that stood out for SUTD's application were the compulsory personal statements and interviews, along with allowing us to key put any sort of information. (Allowed us to upload links to youtube, linkedin, github, even had the option to put in a dropbox link for any other side projects)",6/12/2021 13:21,NEU,NEU
1981,hnge95g,"Thank you so much for replying! Also, may I ask how the application process was for you? Was it hard or did it go pretty smoothly?",6/12/2021 13:17,POS,NEU
108,k80xnx6,"The hostels in SUTD are really dead. There’re no hostel wide festive events like Halloween horror nights, door-to-door chalking, inter-hostel games, hostel outings, etc. Go to NUS/NTU for a vibrant hostel life.",6/11/2023 3:39,NEG,NEU
109,k80mxm6,"Getting a PhD from NUS gives you more credibility because it’s literally up in the global rankings (top 8 in QS rankings) mainly due to their research output and quality. 

I would say, if you get rejected by NUS, try again next time. It’s not worth it to spend years to get a PhD in a relatively unknown uni. Also, there will be good and bad profs in all unis, including SUTD.",6/11/2023 2:18,POS,NEU
104,k83e686,"Better mental health? Huge joke. Our culture isn’t as great as you think it is. The comments you see on Reddit about SUTD are very romanticised imo.

Having a trimester curriculum like SIT is horrible. We get shorter internship availabilities as compared to NUS/NTU/SMU and we even flex about STAYING UP TILL DAWN (SUTD) culture so much so that we even wear t-shirts with that slogan. There are many times where me and my friends stay up till 4am+ or no sleep at all. And this is being celebrated in our sch culture. 

Also, there are politics and drama everywhere in the world, including SUTD. And since our uni population is so small, any rumour (eg. Bad breakup, misunderstandings etc.) be it true or false, will spread to the whole sch quickly. Bullying cases exists, sexual harassment cases exists in our uni too, and victims are too scared to speak up about it because our school is so small that it’s not worth standing up against the perpetrators.",6/11/2023 17:26,NEG,NEU
105,k837l1p,"what is uas?? normally called rank point or indicative grade profile right. anyway cut off around 70. below that case by case (might not even interview). u can pm me if have qn i am an ambassador (self declared)

&#x200B;

work life balance is super good (but limited to esd :P)",6/11/2023 16:46,POS,NEU
106,k82of75,Better mental health? Boy you are in for a rude surprise here.,6/11/2023 14:44,NEG,NEU
107,17p1ifb,What is the minimum UAS i need to enter SUTD?,6/11/2023 12:21,NEU,NEU
1911,hripnmv,"If your grades are decent, there should be no problem getting in at all. 

SUTD do look at your holistic development so do display your CCAs or outside school achievements or hobbies. They evaluate based on who you are and what are your aspirations and if SUTD can help you achieve that.",6/1/2022 17:54,POS,NEU
180,jz6fw1t,"Hey, thank you so much for your comment, this cleared up alot of confusions and anxiety TvT",5/9/2023 2:08,POS,POS
1320,in5xl24,May I know what is the GPA requirements for poly students who are looking at the STEP scholarship? ( Probably based on seniors exp?),5/9/2022 9:18,NEU,NEU
224,juvpmpw,"Might stick to a VM, maybe parallels. Thanks!",5/8/2023 10:26,POS,POS
2107,h7s6iif,"Try looking in your junk folder. By the way, are you a graduate student who will be starting in the fall? 

In the document, you were informed of the type of room you had been offered and the steps for accepting it. As an international student, I must notify the housing office when I arrive about SHN and my intended check-in date.",5/8/2021 8:24,NEU,NEU
2108,h7s61q2,So the offer just confirms is it? Does it also tell you what time you can check in? I haven't received anything,5/8/2021 8:17,NEG,NEU
2109,h7s5r05,I received hosing offer yesterday late afternoon.,5/8/2021 8:13,NEU,NEU
2110,h7s5onm,"Strange, I just looked through all the documents and I can't seem to find the date. What does the housing application results say, does it tell you your check-in time?",5/8/2021 8:12,NEG,NEU
2111,h7s3sdt,"Hi, I took the EWET back in 2018, I'm not sure if things have changed since then, but I'll contribute what I can remember.

It was a 1.5-hours test in an LT (or was it an hour long?), and if I'm not wrong it was basically a mix of GP Paper 1 and GP AQ, if you're familiar with the 'A' Levels. For those who aren't, basically it's an essay for us to discuss a given topic. (Though, I can't remember if a strictly argumentative essay was expected. But I don't think it makes a big difference in answering your question about what the EWET is.) There's no right or wrong answer, they just want to see how you argue and your command of English. I don't know of anyone who failed it, and I don't think you will fail unless your English is really atrocious. (That's what my OGLs told me at least.)

And also, while I did say it was a mix of GP Paper 1 and GP AQ, I really cannot remember if we were merely given a topic to talk about, or a passage to read as a springboard. I think it's the latter, but it's been over three years!",5/8/2021 7:45,NEU,NEU
2112,h7rzjs9,It was stated in the housing application package.,5/8/2021 6:47,NEU,NEU
2113,h7rzea7,"Thanks, I received it late afternoon yesterday.",5/8/2021 6:45,POS,POS
2106,h7slu82,"ah....my bad i misread graduate as undergraduate, no wonder i couldn't find anything lol. thanks for offering help tho, much appreciated!",5/8/2021 11:46,POS,POS
429,jmyhtnp,Any updates....did anyone receive any mail regarding the interview or after the interview call?,5/6/2023 6:11,NEU,NEU
427,jn10rqr,"hi thank you for letting me know! 

Were you notified by the school directly through email that you are in the second acceptance window?",5/6/2023 19:46,NEU,NEU
428,jn0bpkg,"Hi yes I submitted ASD as my preferred choice during application! 

Got told in May that I was in second acceptance window, that I’ll be notified in Early June. 

Notified on 1st June (that’s very fast) of acceptance!",5/6/2023 16:49,POS,NEU
2222,nt4x9m,Laptop recommendations (particularly for ESD),5/6/2021 20:44,NEU,NEU
2224,h0mxufb,"It will be an issue for assemblies involving more components. If you have a desktop pc at home or a teammate with decent cpu gpu to cad the model you don't really need a good laptop for getting through undergrad. But having the option to have multiple people design the model or not worrying about being unable to open the model for reference during end of term crunch time is definitely welcome.

Side note. Gpu is not just used for rendering. I did a side project involving physics simulations and decided to use Unity, utilizing parallelization with a compute shader. Although there are ways to solve SOME problems analytically given enough research, sometimes you never know when having a good gpu on hand to simulate/brute force a solution will come in handy.",5/6/2021 1:19,POS,NEU
2223,h0pozzd,[removed],5/6/2021 18:41,NEU,NEU
688,jixyslz,When did y’all get the email?,5/5/2023 9:45,NEU,NEU
689,jixx9rq,"Hi! Thank you so much. I’ll think about what I want to know and i’ll get back to you. Again, thank you!",5/5/2023 9:23,POS,POS
690,jixwjhf,hi! i’m going for the luncheon but i was offered step… but you can dm me w whatever qns you have for sharp! i’ll help you ask and get back to you on them directly aft on the day of :),5/5/2023 9:12,POS,NEG
691,jixr63r,Hi are u looking for international A levels or Singapore’s?,5/5/2023 7:52,NEU,NEU
692,jixnlba,Other Unis have started their offers but those have deadlines to accept. Wondering if SUTD is starting to give out offer/rejections for A Level students.,5/5/2023 7:01,NEU,NEU
693,138dm0c,SUTD A Level Application Results 2023,5/5/2023 7:00,NEU,NEU
694,jixne1q,M or F,5/5/2023 6:58,NEU,NEU
684,jiy9k70,offer reception’s on the 6th or the 20th and the special programs thing is on the 20th,5/5/2023 11:50,NEU,NEU
685,jiy9dzv,hi you can dm me for any questions regarding sharp too :),5/5/2023 11:49,NEU,NEU
686,jiy8fvp,When is it though?,5/5/2023 11:40,NEU,NEU
687,jiy4nku,I got mine on the third,5/5/2023 11:00,NEU,NEU
1604,uj94tz,HackFest 2022: Registrations Open!,5/5/2022 22:33,NEU,NEU
1605,i7gacsi,"Yepp I do acknowledge that part about SUTD and even mentioned that to the interviewer. However, NUS CHS also allows me to do the same thing albeit like every courses available in NUS. That’s why it was so hard to choose.",5/5/2022 17:46,NEU,NEU
1606,i7fswmn,"Just a perspective. I was intending to do computing... but I realised computing is not my passion. I just don't like the culture in computing ba (not dissing computing in any way here, just my own perferrence) The good thing about sutd, at least, you got your first year to really decide whether you want computing (since it is a common engineering year), else you have to suffer with that degree.",5/5/2022 15:47,NEU,NEU
2373,gx09zq0,I see. Thank you so much for the insight!,5/5/2021 9:21,POS,POS
2374,n5bohq,Regarding SUTD tuition fees and hostel fees,5/5/2021 9:14,NEU,NEU
2375,gx08vfa,"generally, yes. You might need to top up a bit depending on how the fees shake out.",5/5/2021 9:03,NEU,NEU
2376,gx05c31,"One more question, is it true that most scholarships that are administered by SUTD only cover the amount of fees payable by Singapore citizen after tuition grant?",5/5/2021 8:07,NEU,NEU
2377,gx01eaw,thanks so much! was a little worried that i had to pay for the subscription for all the programmes needed,5/5/2021 7:08,POS,POS
2378,gx00kyt,"I am a Freshmore student and so these have been more than sufficient for all my coursework and projects. However what programs you use most frequently really depends on the Pillar choice. For example, ESD students may need to use R and MATLAB more, while ASD students use Rhino3D almost exclusively. EPD students will use a lot more AutoCAD Fusion360 and/or Solidworks. I believe if the program is required by the school curriculum, there is a school licence for it, so dont worry too much :)",5/5/2021 6:57,POS,NEU
2379,gwzqtj3,"> So far no issues finding internships here. I have clocked in 2 internships. Full time according to seniors are okay. Some got into Big tech.

I have only heard of one person getting into Google internship for the entire history of SUTD. No one got a Facebook internship.

I understand that the career centre will offer ZERO help to freshies in the summer after Term 2. Freshies are even explicitly BARRED from participating Career & Internship Fair in January. The career centre even recommends freshies NOT to find internship for the summer after Term 2.

Please indicate if this is true, and please indicate your comments.",5/5/2021 4:56,NEU,NEU
2380,gwzqo4z,Yo this is some insane stuff,5/5/2021 4:54,NEG,NEU
2381,gwzq8nl, https://data.gov.sg/dataset/intake-enrolment-and-graduates-by-institutions,5/5/2021 4:49,NEU,NEU
2382,gwzovdp,"Good point (thats why I try to be cautious w the word ""about"" but thx for the clarification!)",5/5/2021 4:35,POS,NEU
2383,gwzkiy5,thanks so much! are these few programmes you mentioned sufficient for the curriculum?,5/5/2021 3:51,POS,NEU
2384,gwzcrca,"The school's IT dept provides school accounts for Solidworks, Fusion360, Rhino3D, Adobe Creative Cloud and MATLAB. There might be more but these are the ones I have used so far. For Rhino3D, the account only works on school network, but they will help you to set up a VPN. Once we graduate though, our accounts would be terminated.",5/5/2021 2:41,NEU,NEU
2385,gwz9yti,"Thanks for the feedback! While you're here, may I know what do you think is a decent enough CPU and graphics card? And would you recommend AMD or Intel for the CPU?

As far as I know, the MX350 is good enough for gameplay, so shouldn't it be sufficient for simple 3D rendering in CAD?

As my budget is somewhat limited, I don't think I can afford another tablet like iPad for handwritten notes. But a drawing tablet does sound like a good idea, so I will look into that.

Lastly, may I know is it recommended to have CAD apps on your personal laptop? Or is it good enough to use these apps on the school computers?

Thanks again for taking the time to answer my questions.🙇‍♂️",5/5/2021 2:17,POS,NEU
2367,gx38cve,"It's because they wanna milk students who don't have scholarships since they literally burned most money on attracting faculty and students earlier on. I don't think the education or facilities are significantly better than NUS/NTU, in fact SUTD being a smaller faculty and school it's more constrained.

That being said, it inspired some students to find wealth to escape the rat race. Some alumnus yolo'ed into crypto early on and have enough money to retire upon graduation XD (the surveys don't tell you this)",5/5/2021 23:38,NEG,NEU
2386,gwz7if3,i would also like to ask if the uni provides student accounts for any kind of computer softwares you might need for school eg autoCAD. or do you have to pay for those yourself?,5/5/2021 1:57,NEU,NEU
2387,gwz7bc8,thanks for the insight!,5/5/2021 1:56,POS,POS
2368,gx2d7m3,"Moe tuition grant is granted after you sign a form during matriculation. Depending on your citizenship status, grant will differ 

Further subsides will be based on financial status and meriit. You can look up to financial aid/scholarship in sutd official website ..",5/5/2021 19:49,NEU,NEU
